{
  "annuity_evidence": [
    {
      "attained_age_years": 68,
      "authority_id": "AUTHORITY-A",
      "case_id": "ANNUITY-DEMO-001",
      "contract_reference": "CONTRACT-DEMO-001",
      "contract_status": "ACTIVE",
      "credited_service_years": 12,
      "currency": "USD",
      "declared_periodic_payout_minor": 1250000,
      "evidence_commitment": "slang_annuity_evidence_sha256:73b21709b794be206a50f5c0704cc261fc482b930e1f6bc5d497d838e3cbdd9f",
      "minimum_contribution_minor": 15000000,
      "minimum_start_age_years": 65,
      "minimum_vesting_years": 10,
      "payee_status": "VALID",
      "payout_election": "ELECTED",
      "schema": "ANNUITY-PAYOUT-AUTHORITY-EVIDENCE-1",
      "total_contributed_minor": 18000000
    }
  ],
  "context": {
    "case_id": "ANNUITY-DEMO-001",
    "contract_reference": "CONTRACT-DEMO-001",
    "currency": "USD",
    "evaluation_authorized": true,
    "evidence_mode": "SINGLE_AUTHORITY",
    "expected_authority_ids": [
      "AUTHORITY-A"
    ],
    "payout_mode": "ANNUITANT_PERIODIC",
    "visibility_authorized": true
  },
  "declared_context_id": "slang_annuity_context_sha256:f5ef1cdebef27e9c88e9cfcff7bbf940fa88f88ce2aace1b27e8c6d1aee62288",
  "declared_evidence_set_id": "slang_annuity_evidence_set_sha256:babae59837513e726d2882422e211cc0cb87c29809495a230d5f90f2b34327a8",
  "profile_id": "SLANG-ANNUITY-PROFILE-1-D01",
  "ruleset_id": "SLANG-ANNUITY-RULESET-1-D01",
  "schema": "SLANG-ANNUITY-INPUT-1"
}
